Age,Age (bin),Cabin,Embarked,Family Size,Name,Passenger Id,Sex,Survived,Ticket,Ticket Class,Fare,Number of Records,Parch,Sib Sp
,,C106,Southampton,1,"Saalfeld, Mr. Adolphe",299,M,Survived,19988,Up,30.5,1,0,0
50,50,B58 B60,Cherbourg,2,"Baxter, Mrs. James (Helene DeLaudeniere Chaput)",300,F,Survived,PC 17558,Up,247.5208,1,1,0
,,,Queenstown,1,"Kelly, Miss. Anna Katherine ""Annie Kate""",301,F,Survived,9234,Low,7.75,1,0,0
,,,Queenstown,3,"McCoy, Mr. Bernard",302,M,Survived,367226,Low,23.25,1,0,2
19,15,,Southampton,1,"Johnson, Mr. William Cahoone Jr",303,M,Died,LINE,Low,0,1,0,0
,,E101,Queenstown,1,"Keane, Miss. Nora A",304,F,Survived,226593,Mid,12.35,1,0,0
,,,Southampton,1,"Williams, Mr. Howard Hugh ""Harry""",305,M,Died,A/5 2466,Low,8.05,1,0,0
0.92,0,C22 C26,Southampton,4,"Allison, Master. Hudson Trevor",306,M,Survived,113781,Up,151.55,1,2,1
,,,Cherbourg,1,"Fleming, Miss. Margaret",307,F,Survived,17421,Up,110.8833,1,0,0
17,15,C65,Cherbourg,2,"Penasco y Castellana, Mrs. Victor de Satode (Maria Josefa Perez de Soto y Vallejo)",308,F,Survived,PC 17758,Up,108.9,1,0,1
30,30,,Cherbourg,2,"Abelson, Mr. Samuel",309,M,Died,P/PP 3381,Mid,24,1,0,1
30,30,E36,Cherbourg,1,"Francatelli, Miss. Laura Mabel",310,F,Survived,PC 17485,Up,56.9292,1,0,0
24,20,C54,Cherbourg,1,"Hays, Miss. Margaret Bechstein",311,F,Survived,11767,Up,83.1583,1,0,0
18,15,B57 B59 B63 B66,Cherbourg,5,"Ryerson, Miss. Emily Borie",312,F,Survived,PC 17608,Up,262.375,1,2,2
26,25,,Southampton,3,"Lahtinen, Mrs. William (Anna Sylfven)",313,F,Died,250651,Mid,26,1,1,1
28,25,,Southampton,1,"Hendekovic, Mr. Ignjac",314,M,Died,349243,Low,7.8958,1,0,0
43,40,,Southampton,3,"Hart, Mr. Benjamin",315,M,Died,F.C.C. 13529,Mid,26.25,1,1,1
26,25,,Southampton,1,"Nilsson, Miss. Helmina Josefina",316,F,Survived,347470,Low,7.8542,1,0,0
24,20,,Southampton,2,"Kantor, Mrs. Sinai (Miriam Sternin)",317,F,Survived,244367,Mid,26,1,0,1
54,50,,Southampton,1,"Moraweck, Dr. Ernest",318,M,Died,29011,Mid,14,1,0,0
31,30,C7,Southampton,3,"Wick, Miss. Mary Natalie",319,F,Survived,36928,Up,164.8667,1,2,0
40,40,E34,Cherbourg,3,"Spedden, Mrs. Frederic Oakley (Margaretta Corning Stone)",320,F,Survived,16966,Up,134.5,1,1,1
22,20,,Southampton,1,"Dennis, Mr. Samuel",321,M,Died,A/5 21172,Low,7.25,1,0,0
27,25,,Southampton,1,"Danoff, Mr. Yoto",322,M,Died,349219,Low,7.8958,1,0,0
30,30,,Queenstown,1,"Slayter, Miss. Hilda Mary",323,F,Survived,234818,Mid,12.35,1,0,0
22,20,,Southampton,3,"Caldwell, Mrs. Albert Francis (Sylvia Mae Harbaugh)",324,F,Survived,248738,Mid,29,1,1,1
,,,Southampton,11,"Sage, Mr. George John Jr",325,M,Died,CA. 2343,Low,69.55,1,2,8
36,35,C32,Cherbourg,1,"Young, Miss. Marie Grice",326,F,Survived,PC 17760,Up,135.6333,1,0,0
61,60,,Southampton,1,"Nysveen, Mr. Johan Hansen",327,M,Died,345364,Low,6.2375,1,0,0
36,35,D,Southampton,1,"Ball, Mrs. (Ada E Hall)",328,F,Survived,28551,Mid,13,1,0,0
31,30,,Southampton,3,"Goldsmith, Mrs. Frank John (Emily Alice Brown)",329,F,Survived,363291,Low,20.525,1,1,1
16,15,B18,Cherbourg,2,"Hippach, Miss. Jean Gertrude",330,F,Survived,111361,Up,57.9792,1,1,0
,,,Queenstown,3,"McCoy, Miss. Agnes",331,F,Survived,367226,Low,23.25,1,0,2
45.5,45,C124,Southampton,1,"Partner, Mr. Austen",332,M,Died,113043,Up,28.5,1,0,0
38,35,C91,Southampton,2,"Graham, Mr. George Edward",333,M,Died,PC 17582,Up,153.4625,1,1,0
16,15,,Southampton,3,"Vander Planke, Mr. Leo Edmondus",334,M,Died,345764,Low,18,1,0,2
,,,Southampton,2,"Frauenthal, Mrs. Henry William (Clara Heinsheimer)",335,F,Survived,PC 17611,Up,133.65,1,0,1
,,,Southampton,1,"Denkoff, Mr. Mitto",336,M,Died,349225,Low,7.8958,1,0,0
29,25,C2,Southampton,2,"Pears, Mr. Thomas Clinton",337,M,Died,113776,Up,66.6,1,0,1
41,40,E40,Cherbourg,1,"Burns, Miss. Elizabeth Margaret",338,F,Survived,16966,Up,134.5,1,0,0
45,45,,Southampton,1,"Dahl, Mr. Karl Edwart",339,M,Survived,7598,Low,8.05,1,0,0
45,45,T,Southampton,1,"Blackwell, Mr. Stephen Weart",340,M,Died,113784,Up,35.5,1,0,0
2,0,F2,Southampton,3,"Navratil, Master. Edmond Roger",341,M,Survived,230080,Mid,26,1,1,1
24,20,C23 C25 C27,Southampton,6,"Fortune, Miss. Alice Elizabeth",342,F,Survived,19950,Up,263,1,2,3
28,25,,Southampton,1,"Collander, Mr. Erik Gustaf",343,M,Died,248740,Mid,13,1,0,0
25,25,,Southampton,1,"Sedgwick, Mr. Charles Frederick Waddington",344,M,Died,244361,Mid,13,1,0,0
36,35,,Southampton,1,"Fox, Mr. Stanley Hubert",345,M,Died,229236,Mid,13,1,0,0
24,20,F33,Southampton,1,"Brown, Miss. Amelia ""Mildred""",346,F,Survived,248733,Mid,13,1,0,0
40,40,,Southampton,1,"Smith, Miss. Marion Elsie",347,F,Survived,31418,Mid,13,1,0,0
,,,Southampton,2,"Davison, Mrs. Thomas Henry (Mary E Finck)",348,F,Survived,386525,Low,16.1,1,0,1
3,0,,Southampton,3,"Coutts, Master. William Loch ""William""",349,M,Survived,C.A. 37671,Low,15.9,1,1,1
42,40,,Southampton,1,"Dimic, Mr. Jovan",350,M,Died,315088,Low,8.6625,1,0,0
23,20,,Southampton,1,"Odahl, Mr. Nils Martin",351,M,Died,7267,Low,9.225,1,0,0
,,C128,Southampton,1,"Williams-Lambert, Mr. Fletcher Fellows",352,M,Died,113510,Up,35,1,0,0
15,15,,Cherbourg,3,"Elias, Mr. Tannous",353,M,Died,2695,Low,7.2292,1,1,1
25,25,,Southampton,2,"Arnold-Franchi, Mr. Josef",354,M,Died,349237,Low,17.8,1,0,1
,,,Cherbourg,1,"Yousif, Mr. Wazli",355,M,Died,2647,Low,7.225,1,0,0
28,25,,Southampton,1,"Vanden Steen, Mr. Leo Peter",356,M,Died,345783,Low,9.5,1,0,0
22,20,E33,Southampton,2,"Bowerman, Miss. Elsie Edith",357,F,Survived,113505,Up,55,1,1,0
38,35,,Southampton,1,"Funk, Miss. Annie Clemmer",358,F,Died,237671,Mid,13,1,0,0
,,,Queenstown,1,"McGovern, Miss. Mary",359,F,Survived,330931,Low,7.8792,1,0,0
,,,Queenstown,1,"Mockler, Miss. Helen Mary ""Ellie""",360,F,Survived,330980,Low,7.8792,1,0,0
40,40,,Southampton,6,"Skoog, Mr. Wilhelm",361,M,Died,347088,Low,27.9,1,4,1
29,25,,Cherbourg,2,"del Carlo, Mr. Sebastiano",362,M,Died,SC/PARIS 2167,Mid,27.7208,1,0,1
45,45,,Cherbourg,2,"Barbara, Mrs. (Catherine David)",363,F,Died,2691,Low,14.4542,1,1,0
35,35,,Southampton,1,"Asim, Mr. Adola",364,M,Died,SOTON/O.Q. 3101310,Low,7.05,1,0,0
,,,Queenstown,2,"O'Brien, Mr. Thomas",365,M,Died,370365,Low,15.5,1,0,1
30,30,,Southampton,1,"Adahl, Mr. Mauritz Nils Martin",366,M,Died,C 7076,Low,7.25,1,0,0
60,60,D37,Cherbourg,2,"Warren, Mrs. Frank Manley (Anna Sophia Atkinson)",367,F,Survived,110813,Up,75.25,1,0,1
,,,Cherbourg,1,"Moussa, Mrs. (Mantoura Boulos)",368,F,Survived,2626,Low,7.2292,1,0,0
,,,Queenstown,1,"Jermyn, Miss. Annie",369,F,Survived,14313,Low,7.75,1,0,0
24,20,B35,Cherbourg,1,"Aubart, Mme. Leontine Pauline",370,F,Survived,PC 17477,Up,69.3,1,0,0
25,25,E50,Cherbourg,2,"Harder, Mr. George Achilles",371,M,Survived,11765,Up,55.4417,1,0,1
18,15,,Southampton,2,"Wiklund, Mr. Jakob Alfred",372,M,Died,3101267,Low,6.4958,1,0,1
19,15,,Southampton,1,"Beavan, Mr. William Thomas",373,M,Died,323951,Low,8.05,1,0,0
22,20,,Cherbourg,1,"Ringhini, Mr. Sante",374,M,Died,PC 17760,Up,135.6333,1,0,0
3,0,,Southampton,5,"Palsson, Miss. Stina Viola",375,F,Died,349909,Low,21.075,1,1,3
,,,Cherbourg,2,"Meyer, Mrs. Edgar Joseph (Leila Saks)",376,F,Survived,PC 17604,Up,82.1708,1,0,1
22,20,,Southampton,1,"Landergren, Miss. Aurora Adelia",377,F,Survived,C 7077,Low,7.25,1,0,0
27,25,C82,Cherbourg,3,"Widener, Mr. Harry Elkins",378,M,Died,113503,Up,211.5,1,2,0
20,20,,Cherbourg,1,"Betros, Mr. Tannous",379,M,Died,2648,Low,4.0125,1,0,0
19,15,,Southampton,1,"Gustafsson, Mr. Karl Gideon",380,M,Died,347069,Low,7.775,1,0,0
42,40,,Cherbourg,1,"Bidois, Miss. Rosalie",381,F,Survived,PC 17757,Up,227.525,1,0,0
1,0,,Cherbourg,3,"Nakid, Miss. Maria (""Mary"")",382,F,Survived,2653,Low,15.7417,1,2,0
32,30,,Southampton,1,"Tikkanen, Mr. Juho",383,M,Died,STON/O 2. 3101293,Low,7.925,1,0,0
35,35,,Southampton,2,"Holverson, Mrs. Alexander Oskar (Mary Aline Towner)",384,F,Survived,113789,Up,52,1,0,1
,,,Southampton,1,"Plotcharsky, Mr. Vasil",385,M,Died,349227,Low,7.8958,1,0,0
18,15,,Southampton,1,"Davies, Mr. Charles Henry",386,M,Died,S.O.C. 14879,Mid,73.5,1,0,0
1,0,,Southampton,8,"Goodwin, Master. Sidney Leonard",387,M,Died,CA 2144,Low,46.9,1,2,5
36,35,,Southampton,1,"Buss, Miss. Kate",388,F,Survived,27849,Mid,13,1,0,0
,,,Queenstown,1,"Sadlier, Mr. Matthew",389,M,Died,367655,Low,7.7292,1,0,0
17,15,,Cherbourg,1,"Lehmann, Miss. Bertha",390,F,Survived,SC 1748,Mid,12,1,0,0
36,35,B96 B98,Southampton,4,"Carter, Mr. William Ernest",391,M,Survived,113760,Up,120,1,2,1
21,20,,Southampton,1,"Jansson, Mr. Carl Olof",392,M,Survived,350034,Low,7.7958,1,0,0
28,25,,Southampton,3,"Gustafsson, Mr. Johan Birger",393,M,Died,3101277,Low,7.925,1,0,2
23,20,D36,Cherbourg,2,"Newell, Miss. Marjorie",394,F,Survived,35273,Up,113.275,1,0,1
24,20,G6,Southampton,3,"Sandstrom, Mrs. Hjalmar (Agnes Charlotta Bengtsson)",395,F,Survived,PP 9549,Low,16.7,1,2,0
22,20,,Southampton,1,"Johansson, Mr. Erik",396,M,Died,350052,Low,7.7958,1,0,0
31,30,,Southampton,1,"Olsson, Miss. Elina",397,F,Died,350407,Low,7.8542,1,0,0
46,45,,Southampton,1,"McKane, Mr. Peter David",398,M,Died,28403,Mid,26,1,0,0
23,20,,Southampton,1,"Pain, Dr. Alfred",399,M,Died,244278,Mid,10.5,1,0,0
28,25,,Southampton,1,"Trout, Mrs. William H (Jessie L)",400,F,Survived,240929,Mid,12.65,1,0,0
39,35,,Southampton,1,"Niskanen, Mr. Juha",401,M,Survived,STON/O 2. 3101289,Low,7.925,1,0,0
26,25,,Southampton,1,"Adams, Mr. John",402,M,Died,341826,Low,8.05,1,0,0
21,20,,Southampton,2,"Jussila, Miss. Mari Aina",403,F,Died,4137,Low,9.825,1,0,1
28,25,,Southampton,2,"Hakkarainen, Mr. Pekka Pietari",404,M,Died,STON/O2. 3101279,Low,15.85,1,0,1
20,20,,Southampton,1,"Oreskovic, Miss. Marija",405,F,Died,315096,Low,8.6625,1,0,0
34,30,,Southampton,2,"Gale, Mr. Shadrach",406,M,Died,28664,Mid,21,1,0,1
51,50,,Southampton,1,"Widegren, Mr. Carl/Charles Peter",407,M,Died,347064,Low,7.75,1,0,0
3,0,,Southampton,3,"Richards, Master. William Rowe",408,M,Survived,29106,Mid,18.75,1,1,1
21,20,,Southampton,1,"Birkeland, Mr. Hans Martin Monsen",409,M,Died,312992,Low,7.775,1,0,0
,,,Southampton,5,"Lefebre, Miss. Ida",410,F,Died,4133,Low,25.4667,1,1,3
,,,Southampton,1,"Sdycoff, Mr. Todor",411,M,Died,349222,Low,7.8958,1,0,0
,,,Queenstown,1,"Hart, Mr. Henry",412,M,Died,394140,Low,6.8583,1,0,0
33,30,C78,Queenstown,2,"Minahan, Miss. Daisy E",413,F,Survived,19928,Up,90,1,0,1
,,,Southampton,1,"Cunningham, Mr. Alfred Fleming",414,M,Died,239853,Mid,0,1,0,0
44,40,,Southampton,1,"Sundman, Mr. Johan Julian",415,M,Survived,STON/O 2. 3101269,Low,7.925,1,0,0
,,,Southampton,1,"Meek, Mrs. Thomas (Annie Louise Rowley)",416,F,Died,343095,Low,8.05,1,0,0
34,30,,Southampton,3,"Drew, Mrs. James Vivian (Lulu Thorne Christian)",417,F,Survived,28220,Mid,32.5,1,1,1
18,15,,Southampton,3,"Silven, Miss. Lyyli Karoliina",418,F,Survived,250652,Mid,13,1,2,0
30,30,,Southampton,1,"Matthews, Mr. William John",419,M,Died,28228,Mid,13,1,0,0
10,10,,Southampton,3,"Van Impe, Miss. Catharina",420,F,Died,345773,Low,24.15,1,2,0
,,,Cherbourg,1,"Gheorgheff, Mr. Stanio",421,M,Died,349254,Low,7.8958,1,0,0
21,20,,Queenstown,1,"Charters, Mr. David",422,M,Died,A/5. 13032,Low,7.7333,1,0,0
29,25,,Southampton,1,"Zimmerman, Mr. Leo",423,M,Died,315082,Low,7.875,1,0,0
28,25,,Southampton,3,"Danbom, Mrs. Ernst Gilbert (Anna Sigrid Maria Brogren)",424,F,Died,347080,Low,14.4,1,1,1
18,15,,Southampton,3,"Rosblom, Mr. Viktor Richard",425,M,Died,370129,Low,20.2125,1,1,1
,,,Southampton,1,"Wiseman, Mr. Phillippe",426,M,Died,A/4. 34244,Low,7.25,1,0,0
28,25,,Southampton,2,"Clarke, Mrs. Charles V (Ada Maria Winfield)",427,F,Survived,2003,Mid,26,1,0,1
19,15,,Southampton,1,"Phillips, Miss. Kate Florence (""Mrs Kate Louise Phillips Marshall"")",428,F,Survived,250655,Mid,26,1,0,0
,,,Queenstown,1,"Flynn, Mr. James",429,M,Died,364851,Low,7.75,1,0,0
32,30,E10,Southampton,1,"Pickard, Mr. Berk (Berk Trembisky)",430,M,Survived,SOTON/O.Q. 392078,Low,8.05,1,0,0
28,25,C52,Southampton,1,"Bjornstrom-Steffansson, Mr. Mauritz Hakan",431,M,Survived,110564,Up,26.55,1,0,0
,,,Southampton,2,"Thorneycroft, Mrs. Percival (Florence Kate White)",432,F,Survived,376564,Low,16.1,1,0,1
42,40,,Southampton,2,"Louch, Mrs. Charles Alexander (Alice Adelaide Slow)",433,F,Survived,SC/AH 3085,Mid,26,1,0,1
17,15,,Southampton,1,"Kallio, Mr. Nikolai Erland",434,M,Died,STON/O 2. 3101274,Low,7.125,1,0,0
50,50,E44,Southampton,2,"Silvey, Mr. William Baird",435,M,Died,13507,Up,55.9,1,0,1
14,10,B96 B98,Southampton,4,"Carter, Miss. Lucile Polk",436,F,Survived,113760,Up,120,1,2,1
21,20,,Southampton,5,"Ford, Miss. Doolina Margaret ""Daisy""",437,F,Died,W./C. 6608,Low,34.375,1,2,2
24,20,,Southampton,6,"Richards, Mrs. Sidney (Emily Hocking)",438,F,Survived,29106,Mid,18.75,1,3,2
64,60,C23 C25 C27,Southampton,6,"Fortune, Mr. Mark",439,M,Died,19950,Up,263,1,4,1
31,30,,Southampton,1,"Kvillner, Mr. Johan Henrik Johannesson",440,M,Died,C.A. 18723,Mid,10.5,1,0,0
45,45,,Southampton,3,"Hart, Mrs. Benjamin (Esther Ada Bloomfield)",441,F,Survived,F.C.C. 13529,Mid,26.25,1,1,1
20,20,,Southampton,1,"Hampe, Mr. Leon",442,M,Died,345769,Low,9.5,1,0,0
25,25,,Southampton,2,"Petterson, Mr. Johan Emil",443,M,Died,347076,Low,7.775,1,0,1
28,25,,Southampton,1,"Reynaldo, Ms. Encarnacion",444,F,Survived,230434,Mid,13,1,0,0
,,,Southampton,1,"Johannesen-Bratthammer, Mr. Bernt",445,M,Survived,65306,Low,8.1125,1,0,0
4,0,A34,Southampton,3,"Dodge, Master. Washington",446,M,Survived,33638,Up,81.8583,1,2,0
13,10,,Southampton,2,"Mellinger, Miss. Madeleine Violet",447,F,Survived,250644,Mid,19.5,1,1,0
34,30,,Southampton,1,"Seward, Mr. Frederic Kimber",448,M,Survived,113794,Up,26.55,1,0,0
5,5,,Cherbourg,4,"Baclini, Miss. Marie Catherine",449,F,Survived,2666,Low,19.2583,1,1,2
52,50,C104,Southampton,1,"Peuchen, Major. Arthur Godfrey",450,M,Survived,113786,Up,30.5,1,0,0
36,35,,Southampton,4,"West, Mr. Edwy Arthur",451,M,Died,C.A. 34651,Mid,27.75,1,2,1
,,,Southampton,2,"Hagland, Mr. Ingvald Olai Olsen",452,M,Died,65303,Low,19.9667,1,0,1
30,30,C111,Cherbourg,1,"Foreman, Mr. Benjamin Laventall",453,M,Died,113051,Up,27.75,1,0,0
49,45,C92,Cherbourg,2,"Goldenberg, Mr. Samuel L",454,M,Survived,17453,Up,89.1042,1,0,1
,,,Southampton,1,"Peduzzi, Mr. Joseph",455,M,Died,A/5 2817,Low,8.05,1,0,0
29,25,,Cherbourg,1,"Jalsevac, Mr. Ivan",456,M,Survived,349240,Low,7.8958,1,0,0
65,65,E38,Southampton,1,"Millet, Mr. Francis Davis",457,M,Died,13509,Up,26.55,1,0,0
,,D21,Southampton,2,"Kenyon, Mrs. Frederick R (Marion)",458,F,Survived,17464,Up,51.8625,1,0,1
50,50,,Southampton,1,"Toomey, Miss. Ellen",459,F,Survived,F.C.C. 13531,Mid,10.5,1,0,0
,,,Queenstown,1,"O'Connor, Mr. Maurice",460,M,Died,371060,Low,7.75,1,0,0
48,45,E12,Southampton,1,"Anderson, Mr. Harry",461,M,Survived,19952,Up,26.55,1,0,0
34,30,,Southampton,1,"Morley, Mr. William",462,M,Died,364506,Low,8.05,1,0,0
47,45,E63,Southampton,1,"Gee, Mr. Arthur H",463,M,Died,111320,Up,38.5,1,0,0
48,45,,Southampton,1,"Milling, Mr. Jacob Christian",464,M,Died,234360,Mid,13,1,0,0
,,,Southampton,1,"Maisner, Mr. Simon",465,M,Died,A/S 2816,Low,8.05,1,0,0
38,35,,Southampton,1,"Goncalves, Mr. Manuel Estanslas",466,M,Died,SOTON/O.Q. 3101306,Low,7.05,1,0,0
,,,Southampton,1,"Campbell, Mr. William",467,M,Died,239853,Mid,0,1,0,0
56,55,,Southampton,1,"Smart, Mr. John Montgomery",468,M,Died,113792,Up,26.55,1,0,0
,,,Queenstown,1,"Scanlan, Mr. James",469,M,Died,36209,Low,7.725,1,0,0
0.75,0,,Cherbourg,4,"Baclini, Miss. Helene Barbara",470,F,Survived,2666,Low,19.2583,1,1,2
,,,Southampton,1,"Keefe, Mr. Arthur",471,M,Died,323592,Low,7.25,1,0,0
38,35,,Southampton,1,"Cacic, Mr. Luka",472,M,Died,315089,Low,8.6625,1,0,0
33,30,,Southampton,4,"West, Mrs. Edwy Arthur (Ada Mary Worth)",473,F,Survived,C.A. 34651,Mid,27.75,1,2,1
23,20,D,Cherbourg,1,"Jerwan, Mrs. Amin S (Marie Marthe Thuillard)",474,F,Survived,SC/AH Basle 541,Mid,13.7917,1,0,0
22,20,,Southampton,1,"Strandberg, Miss. Ida Sofia",475,F,Died,7553,Low,9.8375,1,0,0
,,A14,Southampton,1,"Clifford, Mr. George Quincy",476,M,Died,110465,Up,52,1,0,0
34,30,,Southampton,2,"Renouf, Mr. Peter Henry",477,M,Died,31027,Mid,21,1,0,1
29,25,,Southampton,2,"Braund, Mr. Lewis Richard",478,M,Died,3460,Low,7.0458,1,0,1
22,20,,Southampton,1,"Karlsson, Mr. Nils August",479,M,Died,350060,Low,7.5208,1,0,0
2,0,,Southampton,2,"Hirvonen, Miss. Hildur E",480,F,Survived,3101298,Low,12.2875,1,1,0
9,5,,Southampton,8,"Goodwin, Master. Harold Victor",481,M,Died,CA 2144,Low,46.9,1,2,5
,,,Southampton,1,"Frost, Mr. Anthony Wood ""Archie""",482,M,Died,239854,Mid,0,1,0,0
50,50,,Southampton,1,"Rouse, Mr. Richard Henry",483,M,Died,A/5 3594,Low,8.05,1,0,0
63,60,,Southampton,1,"Turkula, Mrs. (Hedwig)",484,F,Survived,4134,Low,9.5875,1,0,0
25,25,B49,Cherbourg,2,"Bishop, Mr. Dickinson H",485,M,Survived,11967,Up,91.0792,1,0,1
,,,Southampton,5,"Lefebre, Miss. Jeannie",486,F,Died,4133,Low,25.4667,1,1,3
35,35,C93,Southampton,2,"Hoyt, Mrs. Frederick Maxfield (Jane Anne Forby)",487,F,Survived,19943,Up,90,1,0,1
58,55,B37,Cherbourg,1,"Kent, Mr. Edward Austin",488,M,Died,11771,Up,29.7,1,0,0
30,30,,Southampton,1,"Somerton, Mr. Francis William",489,M,Died,A.5. 18509,Low,8.05,1,0,0
9,5,,Southampton,3,"Coutts, Master. Eden Leslie ""Neville""",490,M,Survived,C.A. 37671,Low,15.9,1,1,1
,,,Southampton,2,"Hagland, Mr. Konrad Mathias Reiersen",491,M,Died,65304,Low,19.9667,1,0,1
21,20,,Southampton,1,"Windelov, Mr. Einar",492,M,Died,SOTON/OQ 3101317,Low,7.25,1,0,0
55,55,C30,Southampton,1,"Molson, Mr. Harry Markland",493,M,Died,113787,Up,30.5,1,0,0
71,70,,Cherbourg,1,"Artagaveytia, Mr. Ramon",494,M,Died,PC 17609,Up,49.5042,1,0,0
21,20,,Southampton,1,"Stanley, Mr. Edward Roland",495,M,Died,A/4 45380,Low,8.05,1,0,0
,,,Cherbourg,1,"Yousseff, Mr. Gerious",496,M,Died,2627,Low,14.4583,1,0,0
54,50,D20,Cherbourg,2,"Eustis, Miss. Elizabeth Mussey",497,F,Survived,36947,Up,78.2667,1,0,1
,,,Southampton,1,"Shellard, Mr. Frederick William",498,M,Died,C.A. 6212,Low,15.1,1,0,0
25,25,C22 C26,Southampton,4,"Allison, Mrs. Hudson J C (Bessie Waldo Daniels)",499,F,Died,113781,Up,151.55,1,2,1
24,20,,Southampton,1,"Svensson, Mr. Olof",500,M,Died,350035,Low,7.7958,1,0,0
17,15,,Southampton,1,"Calic, Mr. Petar",501,M,Died,315086,Low,8.6625,1,0,0
21,20,,Queenstown,1,"Canavan, Miss. Mary",502,F,Died,364846,Low,7.75,1,0,0
,,,Queenstown,1,"O'Sullivan, Miss. Bridget Mary",503,F,Died,330909,Low,7.6292,1,0,0
37,35,,Southampton,1,"Laitinen, Miss. Kristina Sofia",504,F,Died,4135,Low,9.5875,1,0,0
16,15,B79,Southampton,1,"Maioni, Miss. Roberta",505,F,Survived,110152,Up,86.5,1,0,0
18,15,C65,Cherbourg,2,"Penasco y Castellana, Mr. Victor de Satode",506,M,Died,PC 17758,Up,108.9,1,0,1
33,30,,Southampton,3,"Quick, Mrs. Frederick Charles (Jane Richards)",507,F,Survived,26360,Mid,26,1,2,0
,,,Southampton,1,"Bradley, Mr. George (""George Arthur Brayton"")",508,M,Survived,111427,Up,26.55,1,0,0
28,25,,Southampton,1,"Olsen, Mr. Henry Margido",509,M,Died,C 4001,Low,22.525,1,0,0
26,25,,Southampton,1,"Lang, Mr. Fang",510,M,Survived,1601,Low,56.4958,1,0,0
29,25,,Queenstown,1,"Daly, Mr. Eugene Patrick",511,M,Survived,382651,Low,7.75,1,0,0
,,,Southampton,1,"Webber, Mr. James",512,M,Died,SOTON/OQ 3101316,Low,8.05,1,0,0
36,35,E25,Southampton,1,"McGough, Mr. James Robert",513,M,Survived,PC 17473,Up,26.2875,1,0,0
54,50,,Cherbourg,2,"Rothschild, Mrs. Martin (Elizabeth L. Barrett)",514,F,Survived,PC 17603,Up,59.4,1,0,1
24,20,,Southampton,1,"Coleff, Mr. Satio",515,M,Died,349209,Low,7.4958,1,0,0
47,45,D46,Southampton,1,"Walker, Mr. William Anderson",516,M,Died,36967,Up,34.0208,1,0,0
34,30,F33,Southampton,1,"Lemore, Mrs. (Amelia Milley)",517,F,Survived,C.A. 34260,Mid,10.5,1,0,0
,,,Queenstown,1,"Ryan, Mr. Patrick",518,M,Died,371110,Low,24.15,1,0,0
36,35,,Southampton,2,"Angle, Mrs. William A (Florence ""Mary"" Agnes Hughes)",519,F,Survived,226875,Mid,26,1,0,1
32,30,,Southampton,1,"Pavlovic, Mr. Stefo",520,M,Died,349242,Low,7.8958,1,0,0
30,30,B73,Southampton,1,"Perreault, Miss. Anne",521,F,Survived,12749,Up,93.5,1,0,0
22,20,,Southampton,1,"Vovk, Mr. Janko",522,M,Died,349252,Low,7.8958,1,0,0
,,,Cherbourg,1,"Lahoud, Mr. Sarkis",523,M,Died,2624,Low,7.225,1,0,0
44,40,B18,Cherbourg,2,"Hippach, Mrs. Louis Albert (Ida Sophia Fischer)",524,F,Survived,111361,Up,57.9792,1,1,0
,,,Cherbourg,1,"Kassem, Mr. Fared",525,M,Died,2700,Low,7.2292,1,0,0
40.5,40,,Queenstown,1,"Farrell, Mr. James",526,M,Died,367232,Low,7.75,1,0,0
50,50,,Southampton,1,"Ridsdale, Miss. Lucy",527,F,Survived,W./C. 14258,Mid,10.5,1,0,0
,,C95,Southampton,1,"Farthing, Mr. John",528,M,Died,PC 17483,Up,221.7792,1,0,0
39,35,,Southampton,1,"Salonen, Mr. Johan Werner",529,M,Died,3101296,Low,7.925,1,0,0
23,20,,Southampton,4,"Hocking, Mr. Richard George",530,M,Died,29104,Mid,11.5,1,1,2
2,0,,Southampton,3,"Quick, Miss. Phyllis May",531,F,Survived,26360,Mid,26,1,1,1
,,,Cherbourg,1,"Toufik, Mr. Nakli",532,M,Died,2641,Low,7.2292,1,0,0
17,15,,Cherbourg,3,"Elias, Mr. Joseph Jr",533,M,Died,2690,Low,7.2292,1,1,1
,,,Cherbourg,3,"Peter, Mrs. Catherine (Catherine Rizk)",534,F,Survived,2668,Low,22.3583,1,2,0
30,30,,Southampton,1,"Cacic, Miss. Marija",535,F,Died,315084,Low,8.6625,1,0,0
7,5,,Southampton,3,"Hart, Miss. Eva Miriam",536,F,Survived,F.C.C. 13529,Mid,26.25,1,2,0
45,45,B38,Southampton,1,"Butt, Major. Archibald Willingham",537,M,Died,113050,Up,26.55,1,0,0
30,30,,Cherbourg,1,"LeRoy, Miss. Bertha",538,F,Survived,PC 17761,Up,106.425,1,0,0
,,,Southampton,1,"Risien, Mr. Samuel Beard",539,M,Died,364498,Low,14.5,1,0,0
22,20,B39,Cherbourg,3,"Frolicher, Miss. Hedwig Margaritha",540,F,Survived,13568,Up,49.5,1,2,0
36,35,B22,Southampton,3,"Crosby, Miss. Harriet R",541,F,Survived,WE/P 5735,Up,71,1,2,0
9,5,,Southampton,7,"Andersson, Miss. Ingeborg Constanzia",542,F,Died,347082,Low,31.275,1,2,4
11,10,,Southampton,7,"Andersson, Miss. Sigrid Elisabeth",543,F,Died,347082,Low,31.275,1,2,4
32,30,,Southampton,2,"Beane, Mr. Edward",544,M,Survived,2908,Mid,26,1,0,1
50,50,C86,Cherbourg,2,"Douglas, Mr. Walter Donald",545,M,Died,PC 17761,Up,106.425,1,0,1
64,60,,Southampton,1,"Nicholson, Mr. Arthur Ernest",546,M,Died,693,Up,26,1,0,0
19,15,,Southampton,2,"Beane, Mrs. Edward (Ethel Clarke)",547,F,Survived,2908,Mid,26,1,0,1
,,,Cherbourg,1,"Padro y Manent, Mr. Julian",548,M,Survived,SC/PARIS 2146,Mid,13.8625,1,0,0
33,30,,Southampton,3,"Goldsmith, Mr. Frank John",549,M,Died,363291,Low,20.525,1,1,1
8,5,,Southampton,3,"Davies, Master. John Morgan Jr",550,M,Survived,C.A. 33112,Mid,36.75,1,1,1
17,15,C70,Cherbourg,3,"Thayer, Mr. John Borland Jr",551,M,Survived,17421,Up,110.8833,1,2,0
27,25,,Southampton,1,"Sharp, Mr. Percival James R",552,M,Died,244358,Mid,26,1,0,0
,,,Queenstown,1,"O'Brien, Mr. Timothy",553,M,Died,330979,Low,7.8292,1,0,0
22,20,,Cherbourg,1,"Leeni, Mr. Fahim (""Philip Zenni"")",554,M,Survived,2620,Low,7.225,1,0,0
22,20,,Southampton,1,"Ohman, Miss. Velin",555,F,Survived,347085,Low,7.775,1,0,0
62,60,,Southampton,1,"Wright, Mr. George",556,M,Died,113807,Up,26.55,1,0,0
48,45,A16,Cherbourg,2,"Duff Gordon, Lady. (Lucille Christiana Sutherland) (""Mrs Morgan"")",557,F,Survived,11755,Up,39.6,1,0,1
,,,Cherbourg,1,"Robbins, Mr. Victor",558,M,Died,PC 17757,Up,227.525,1,0,0
39,35,E67,Southampton,3,"Taussig, Mrs. Emil (Tillie Mandelbaum)",559,F,Survived,110413,Up,79.65,1,1,1
36,35,,Southampton,2,"de Messemaeker, Mrs. Guillaume Joseph (Emma)",560,F,Survived,345572,Low,17.4,1,0,1
,,,Queenstown,1,"Morrow, Mr. Thomas Rowan",561,M,Died,372622,Low,7.75,1,0,0
40,40,,Southampton,1,"Sivic, Mr. Husein",562,M,Died,349251,Low,7.8958,1,0,0
28,25,,Southampton,1,"Norman, Mr. Robert Douglas",563,M,Died,218629,Mid,13.5,1,0,0
,,,Southampton,1,"Simmons, Mr. John",564,M,Died,SOTON/OQ 392082,Low,8.05,1,0,0
,,,Southampton,1,"Meanwell, Miss. (Marion Ogden)",565,F,Died,SOTON/O.Q. 392087,Low,8.05,1,0,0
24,20,,Southampton,3,"Davies, Mr. Alfred J",566,M,Died,A/4 48871,Low,24.15,1,0,2
19,15,,Southampton,1,"Stoytcheff, Mr. Ilia",567,M,Died,349205,Low,7.8958,1,0,0
29,25,,Southampton,5,"Palsson, Mrs. Nils (Alma Cornelia Berglund)",568,F,Died,349909,Low,21.075,1,4,0
,,,Cherbourg,1,"Doharr, Mr. Tannous",569,M,Died,2686,Low,7.2292,1,0,0
32,30,,Southampton,1,"Jonsson, Mr. Carl",570,M,Survived,350417,Low,7.8542,1,0,0
62,60,,Southampton,1,"Harris, Mr. George",571,M,Survived,S.W./PP 752,Mid,10.5,1,0,0
53,50,C101,Southampton,3,"Appleton, Mrs. Edward Dale (Charlotte Lamson)",572,F,Survived,11769,Up,51.4792,1,0,2
36,35,E25,Southampton,1,"Flynn, Mr. John Irwin (""Irving"")",573,M,Survived,PC 17474,Up,26.3875,1,0,0
,,,Queenstown,1,"Kelly, Miss. Mary",574,F,Survived,14312,Low,7.75,1,0,0
16,15,,Southampton,1,"Rush, Mr. Alfred George John",575,M,Died,A/4. 20589,Low,8.05,1,0,0
19,15,,Southampton,1,"Patchett, Mr. George",576,M,Died,358585,Low,14.5,1,0,0
34,30,,Southampton,1,"Garside, Miss. Ethel",577,F,Survived,243880,Mid,13,1,0,0
39,35,E44,Southampton,2,"Silvey, Mrs. William Baird (Alice Munger)",578,F,Survived,13507,Up,55.9,1,0,1
,,,Cherbourg,2,"Caram, Mrs. Joseph (Maria Elias)",579,F,Died,2689,Low,14.4583,1,0,1
32,30,,Southampton,1,"Jussila, Mr. Eiriik",580,M,Survived,STON/O 2. 3101286,Low,7.925,1,0,0
25,25,,Southampton,3,"Christy, Miss. Julie Rachel",581,F,Survived,237789,Mid,30,1,1,1
39,35,C68,Cherbourg,3,"Thayer, Mrs. John Borland (Marian Longstreth Morris)",582,F,Survived,17421,Up,110.8833,1,1,1
54,50,,Southampton,1,"Downton, Mr. William James",583,M,Died,28403,Mid,26,1,0,0
36,35,A10,Cherbourg,1,"Ross, Mr. John Hugo",584,M,Died,13049,Up,40.125,1,0,0
,,,Cherbourg,1,"Paulner, Mr. Uscher",585,M,Died,3411,Low,8.7125,1,0,0
18,15,E68,Southampton,3,"Taussig, Miss. Ruth",586,F,Survived,110413,Up,79.65,1,2,0
47,45,,Southampton,1,"Jarvis, Mr. John Denzil",587,M,Died,237565,Mid,15,1,0,0
60,60,B41,Cherbourg,3,"Frolicher-Stehli, Mr. Maxmillian",588,M,Survived,13567,Up,79.2,1,1,1
22,20,,Southampton,1,"Gilinski, Mr. Eliezer",589,M,Died,14973,Low,8.05,1,0,0
,,,Southampton,1,"Murdlin, Mr. Joseph",590,M,Died,A./5. 3235,Low,8.05,1,0,0
35,35,,Southampton,1,"Rintamaki, Mr. Matti",591,M,Died,STON/O 2. 3101273,Low,7.125,1,0,0
52,50,D20,Cherbourg,2,"Stephenson, Mrs. Walter Bertram (Martha Eustis)",592,F,Survived,36947,Up,78.2667,1,0,1
